Name,Price,Rating
"Sharp beak SCREEN CLEANER GEL for Mobiles, Computers, L...",₹49,4.2
"DHE Screen Cleaning Gel Includes Cloth for Computers, L...",₹69,4.3
"Sharp beak Dari.x All in one , ETC Screen Clean & Shine...",₹79,4.1
QUANTUM QHM5570 Card Reader,₹82,3.9
MON N MOL Gaming Mouse pad Mousepad Mousepad,₹85,3.7
Duminas USB Flash Led Light Purple LP Led Light,₹86,3.7
"Redbox Portable and Flexible for Notebook, Laptop, Powe...",₹88,4
Glink mouse pad gaming laptop computer green and black ...,₹89,4.2
Sharp beak Dari.x Screen Clean & Shine Gel - Protect Yo...,₹89,4.2
Glink blue-black dotted print Mousepad,₹89,4.2
QUANTUM qhm5570 tf Card Reader,₹95,3
FashionCraft Back Cover for Vivo V17 Pro,₹97,2.9
"DOTIN MICRO SD USB 2.0 HIGH SPEED CRDN-2 , PACK OF 1 Ca...",₹97,3.6
FashionCraft Back Cover for Oppo A3s,₹97,3.8
FashionCraft Back Cover for Samsung Galaxy A9,₹97,3.3
PrintKing Back Cover for Mi Redmi Y1 Lite,₹98,3.3
PrintKing Back Cover for Mi Redmi Y1 Lite,₹98,3.6
Cooldone Back Cover for Nokia 6.1 A1 Series,₹98,4.1
DCASE Back Cover for Mi Redmi 5A,₹99,4.1
DCASE Back Cover for Mi Redmi 5Aa,₹99,4.1
PRODOT CK _ 607E for Computers,₹99,3.6
"GADGETSMORE LED LIGHT Flexible, Portable, Bendable USB ...",₹99,3.8
"TERABYTE Cleaning Gel Includes Cloth for Computers, Lap...",₹99,3.8
QUANTUM QHM 5570 Card Reader,₹99,3.6
"Stylin USB GADGET USB-11 Led Light, Laptop Accessory",₹99,3.9
GADGETSMORE USB LED LIGHT GHJTE4 Led Light,₹99,3.8
FashionCraft Back Cover for iVooMi Me1,₹99,3.8
DCASE Back Cover for Mi Redmi 5A,₹99,3.8
"DOTIN MICRO SD USB 2.0 HIGH SPEED CRDN-04 , PACK OF 1 C...",₹100,3.5
"DOTIN MICRO SD USB 2.0 HIGH SPEED CRDN-1 , PACK OF 1 Ca...",₹100,4.3
"WORLD SHOPPER Screen Cleaner, Clean and Shine Gel for M...",₹100,4.3
"DOTIN MICRO SD USB 2.0 HIGH SPEED CRDN-10 , PACK OF 1 C...",₹100,3.8
"DOTIN MICRO SD USB 2.0 HIGH SPEED CRDN-1 , PACK OF 1 Ca...",₹100,4.3
PrintKing Back Cover for Asus Zenfone Max Pro M2 as01,₹103,3.8
PrintKing Back Cover for OnePlus Nord,₹103,3.8
PrintKing Back Cover for OnePlus Nord,₹103,1.8
PrintKing Back Cover for OnePlus Nord,₹103,3.5
Platina Flexible Portable Lamp 2pcs LED LIGHT Led Light,₹103,3.3
"WishNdeal Screen Cleaner Kit for Computers, Laptops, Ga...",₹105,3.3
mani kreation lamp USB GADGET Laptop Accessory,₹105,3.3
